<?xml version="1.0"?>
<!DOCTYPE HPCToolkitExperiment [
<!-- ******************************************************************** -->
<!-- HPCToolkit Experiment DTD						  -->
<!-- Version 2.0							  -->
<!-- ******************************************************************** -->
<!ELEMENT HPCToolkitExperiment (Header, (SecCallPathProfile|SecFlatProfile)*)>
<!ATTLIST HPCToolkitExperiment
	  version CDATA #REQUIRED>

  <!-- ****************************************************************** -->

  <!-- Info/NV: flexible name-value pairs: (n)ame; (t)ype; (v)alue -->
  <!ELEMENT Info (NV*)>
  <!ATTLIST Info
	    n CDATA #IMPLIED>
  <!ELEMENT NV EMPTY>
  <!ATTLIST NV
	    n CDATA #REQUIRED
	    t CDATA #IMPLIED
	    v CDATA #REQUIRED>

  <!-- ****************************************************************** -->
  <!-- Header								  -->
  <!-- ****************************************************************** -->
  <!ELEMENT Header (Info*)>
  <!ATTLIST Header
	    n CDATA #REQUIRED>

  <!-- ****************************************************************** -->
  <!-- Section Header							  -->
  <!-- ****************************************************************** -->
  <!ELEMENT SecHeader (MetricTable?, MetricDBTable?, TraceDBTable?, LoadModuleTable?, FileTable?, ProcedureTable?, Info*)>

    <!-- MetricTable: -->
    <!ELEMENT MetricTable (Metric)*>

    <!-- Metric: (i)d; (n)ame -->
    <!--   (v)alue-type: transient type of values -->
    <!--   (t)ype: persistent type of metric -->
    <!--   fmt: format; show; -->
    <!ELEMENT Metric (MetricFormula*, Info?)>
    <!ATTLIST Metric
	      i            CDATA #REQUIRED
	      n            CDATA #REQUIRED
	      v            (raw|final|derived-incr|derived) "raw"
	      t            (inclusive|exclusive|nil) "nil"
	      partner      CDATA #IMPLIED
	      fmt          CDATA #IMPLIED
	      show         (1|0) "1"
	      show-percent (1|0) "1">

    <!-- MetricFormula represents derived metrics: (t)ype; (frm): formula -->
    <!ELEMENT MetricFormula (Info?)>
    <!ATTLIST MetricFormula
	      t   (combine|finalize) "finalize"
	      i   CDATA #IMPLIED
	      frm CDATA #REQUIRED>

    <!-- Metric data, used in sections: (n)ame [from Metric]; (v)alue -->
    <!ELEMENT M EMPTY>
    <!ATTLIST M
	      n CDATA #REQUIRED
	      v CDATA #REQUIRED>

    <!-- MetricDBTable: -->
    <!ELEMENT MetricDBTable (MetricDB)*>

    <!-- MetricDB: (i)d; (n)ame -->
    <!--   db-glob:        file glob describing files in metric db -->
    <!--   db-id:          id within metric db -->
    <!--   db-num-metrics: number of metrics in db -->
    <!--   db-header-sz:   size (in bytes) of a db file header -->
    <!ELEMENT MetricDB EMPTY>
    <!ATTLIST MetricDB
	      i              CDATA #REQUIRED
	      n              CDATA #REQUIRED
	      db-glob        CDATA #IMPLIED
	      db-id          CDATA #IMPLIED
	      db-num-metrics CDATA #IMPLIED
	      db-header-sz   CDATA #IMPLIED>

    <!-- TraceDBTable: -->
    <!ELEMENT TraceDBTable (TraceDB)>

    <!-- TraceDB: (i)d -->
    <!--   db-min-time: min beginning time stamp (global) -->
    <!--   db-max-time: max ending time stamp (global) -->
    <!ELEMENT TraceDB EMPTY>
    <!ATTLIST TraceDB
	      i            CDATA #REQUIRED
	      db-glob      CDATA #IMPLIED
	      db-min-time  CDATA #IMPLIED
	      db-max-time  CDATA #IMPLIED
	      db-header-sz CDATA #IMPLIED>

    <!-- LoadModuleTable assigns a short name to a load module -->
    <!ELEMENT LoadModuleTable (LoadModule)*>

    <!ELEMENT LoadModule (Info?)>
    <!ATTLIST LoadModule
	      i CDATA #REQUIRED
	      n CDATA #REQUIRED>

    <!-- FileTable assigns a short name to a file -->
    <!ELEMENT FileTable (File)*>

    <!ELEMENT File (Info?)>
    <!ATTLIST File
	      i CDATA #REQUIRED
	      n CDATA #REQUIRED>

    <!-- ProcedureTable assigns a short name to a procedure -->
    <!ELEMENT ProcedureTable (Procedure)*>

    <!ELEMENT Procedure (Info?)>
    <!ATTLIST Procedure
	      i CDATA #REQUIRED
	      n CDATA #REQUIRED>

  <!-- ****************************************************************** -->
  <!-- Section: Call path profile					  -->
  <!-- ****************************************************************** -->
  <!ELEMENT SecCallPathProfile (SecHeader, SecCallPathProfileData)>
  <!ATTLIST SecCallPathProfile
	    i CDATA #REQUIRED
	    n CDATA #REQUIRED>

    <!ELEMENT SecCallPathProfileData (PF|M)*>
      <!-- Procedure frame -->
      <!--   (i)d: unique identifier for cross referencing -->
      <!--   (s)tatic scope id -->
      <!--   (n)ame: a string or an id in ProcedureTable -->
      <!--   (lm) load module: a string or an id in LoadModuleTable -->
      <!--   (f)ile name: a string or an id in LoadModuleTable -->
      <!--   (l)ine range: "beg-end" (inclusive range) -->
      <!--   (a)lien: whether frame is alien to enclosing P -->
      <!--   (v)ma-range-set: "{[beg-end), [beg-end)...}" -->
      <!ELEMENT PF (PF|Pr|L|C|S|M)*>
      <!ATTLIST PF
		i  CDATA #IMPLIED
		s  CDATA #IMPLIED
		n  CDATA #REQUIRED
		lm CDATA #IMPLIED
		f  CDATA #IMPLIED
		l  CDATA #IMPLIED
		v  CDATA #IMPLIED>
      <!-- Procedure (static): GOAL: replace with 'P' -->
      <!ELEMENT Pr (Pr|L|C|S|M)*>
      <!ATTLIST Pr
                i  CDATA #IMPLIED
		s  CDATA #IMPLIED
                n  CDATA #REQUIRED
		lm CDATA #IMPLIED
		f  CDATA #IMPLIED
                l  CDATA #IMPLIED
		a  (1|0) "0"
		v  CDATA #IMPLIED>
      <!-- Callsite (a special StatementRange) -->
      <!ELEMENT C (PF|M)*>
      <!ATTLIST C
		i CDATA #IMPLIED
		s CDATA #IMPLIED
		l CDATA #IMPLIED
		v CDATA #IMPLIED>

  <!-- ****************************************************************** -->
  <!-- Section: Flat profile						  -->
  <!-- ****************************************************************** -->
  <!ELEMENT SecFlatProfile (SecHeader, SecFlatProfileData)>
  <!ATTLIST SecFlatProfile
	    i CDATA #REQUIRED
	    n CDATA #REQUIRED>

    <!ELEMENT SecFlatProfileData (LM|M)*>
      <!-- Load module: (i)d; (n)ame; (v)ma-range-set -->
      <!ELEMENT LM (F|P|M)*>
      <!ATTLIST LM
                i CDATA #IMPLIED
                n CDATA #REQUIRED
		v CDATA #IMPLIED>
      <!-- File -->
      <!ELEMENT F (P|L|S|M)*>
      <!ATTLIST F
                i CDATA #IMPLIED
                n CDATA #REQUIRED>
      <!-- Procedure (Note 1) -->
      <!ELEMENT P (P|A|L|S|C|M)*>
      <!ATTLIST P
                i CDATA #IMPLIED
                n CDATA #REQUIRED
                l CDATA #IMPLIED
		v CDATA #IMPLIED>
      <!-- Alien (Note 1) -->
      <!ELEMENT A (A|L|S|C|M)*>
      <!ATTLIST A
                i CDATA #IMPLIED
                f CDATA #IMPLIED
                n CDATA #IMPLIED
                l CDATA #IMPLIED
		v CDATA #IMPLIED>
      <!-- Loop (Note 1,2) -->
      <!ELEMENT L (A|Pr|L|S|C|M)*>
      <!ATTLIST L
		i CDATA #IMPLIED
		s CDATA #IMPLIED
		l CDATA #IMPLIED
	        f CDATA #IMPLIED
		v CDATA #IMPLIED>
      <!-- Statement (Note 2) -->
      <!--   (it): trace record identifier -->
      <!ELEMENT S (S|M)*>
      <!ATTLIST S
		i  CDATA #IMPLIED
		it CDATA #IMPLIED
		s  CDATA #IMPLIED
		l  CDATA #IMPLIED
		v  CDATA #IMPLIED>
      <!-- Note 1: Contained Cs may not contain PFs -->
      <!-- Note 2: The 's' attribute is not used for flat profiles -->
]>
<HPCToolkitExperiment version="2.0">
<Header n="test1">
  <Info/>
</Header>
<SecCallPathProfile i="0" n="test1">
<SecHeader>
  <MetricTable>
    <Metric i="624" n="WALLCLOCK (usec):Sum (I)" v="derived-incr" t="inclusive" partner="625" show="1" show-percent="1">
      <MetricFormula t="combine" frm="sum($624, $624)"/>
      <MetricFormula t="finalize" frm="$624"/>
      <Info><NV n="units" v="events"/></Info>
    </Metric>
    <Metric i="625" n="WALLCLOCK (usec):Sum (E)" v="derived-incr" t="exclusive" partner="624" show="1" show-percent="1">
      <MetricFormula t="combine" frm="sum($625, $625)"/>
      <MetricFormula t="finalize" frm="$625"/>
      <Info><NV n="units" v="events"/></Info>
    </Metric>
  </MetricTable>
  <MetricDBTable>
  </MetricDBTable>
  <TraceDBTable>
    <TraceDB i="0" db-glob="*.hpctrace" db-min-time="1471328698440537" db-max-time="1471340247303170" db-header-sz="32"/>
  </TraceDBTable>
  <LoadModuleTable>
    <LoadModule i="2" n="/global/u2/h/hashim/GitLab/ALLVM/openMP_exp/build/test1"/>
    <LoadModule i="171937" n="~unknown-load-module~"/>
  </LoadModuleTable>
  <FileTable>
    <File i="1159" n="/global/common/edison/usg/hpctoolkit/build/hpctoolkit-externals/BUILD/libmonitor/work/src/../../libmonitor-0.x-r149/src/mpi_final_c.c"/>
    <File i="1225" n="/global/common/edison/usg/hpctoolkit/build/hpctoolkit-externals/BUILD/libmonitor/work/src/../../libmonitor-0.x-r149/src/pthread.c"/>
    <File i="35583" n="./src/usr/include/string.h"/>
    <File i="37910" n="/usr/src/packages/BUILD/glibc-2.11.3/string/../sysdeps/x86_64/multiarch/../strlen.S"/>
    <File i="48562" n="/usr/src/packages/BUILD/gcc-4.3.4-20091019/obj-x86_64-suse-linux/x86_64-suse-linux/libgcc/../../../libgcc/../gcc/unwind-dw2-fde-glibc.c"/>
    <File i="48672" n="../../../libgcc/../gcc/unwind-dw2-fde-glibc.c"/>
    <File i="48688" n="/usr/src/packages/BUILD/gcc-4.3.4-20091019/obj-x86_64-suse-linux/x86_64-suse-linux/libgcc/../../../libgcc/../gcc/unwind-dw2-fde.c"/>
    <File i="48843" n="../../../libgcc/../gcc/unwind-dw2-fde.c"/>
    <File i="48844" n="/usr/src/packages/BUILD/gcc-4.3.4-20091019/obj-x86_64-suse-linux/x86_64-suse-linux/libgcc/../../../libgcc/../gcc/unwind-pe.h"/>
    <File i="49189" n="/usr/src/packages/BUILD/gcc-4.3.4-20091019/obj-x86_64-suse-linux/x86_64-suse-linux/libgcc/../../../libgcc/../gcc/unwind-dw2.c"/>
    <File i="50390" n="/usr/src/packages/BUILD/gcc-4.3.4-20091019/obj-x86_64-suse-linux/x86_64-suse-linux/libgcc/../../../libgcc/../gcc/unwind.inc"/>
    <File i="63041" n="/usr/src/packages/BUILD/glibc-2.11.3/libio/fileops.c"/>
    <File i="63704" n="/usr/src/packages/BUILD/glibc-2.11.3/libio/genops.c"/>
    <File i="64708" n="/usr/src/packages/BUILD/glibc-2.11.3/libio/iofwrite.c"/>
    <File i="64849" n="/usr/src/packages/BUILD/glibc-2.11.3/libio/ioputs.c"/>
    <File i="69230" n="/usr/src/packages/BUILD/glibc-2.11.3/misc/../sysdeps/unix/syscall-template.S"/>
    <File i="70092" n="/usr/src/packages/BUILD/glibc-2.11.3/nptl/../nptl/sysdeps/unix/sysv/linux/pt-raise.c"/>
    <File i="70098" n="/usr/src/packages/BUILD/glibc-2.11.3/nptl/../sysdeps/unix/sysv/linux/x86_64/sigaction.c"/>
    <File i="70278" n="/usr/src/packages/BUILD/glibc-2.11.3/nptl/../nptl/sysdeps/unix/sysv/linux/x86_64/lowlevellock.S"/>
    <File i="70675" n="/usr/src/packages/BUILD/glibc-2.11.3/nptl/../nptl/sysdeps/unix/sysv/linux/x86_64/pthread_cond_signal.S"/>
    <File i="71079" n="/usr/src/packages/BUILD/glibc-2.11.3/nptl/../nptl/sysdeps/unix/sysv/linux/x86_64/pthread_cond_wait.S"/>
    <File i="71619" n="/usr/src/packages/BUILD/glibc-2.11.3/nptl/../sysdeps/unix/syscall-template.S"/>
    <File i="72154" n="/usr/src/packages/BUILD/glibc-2.11.3/nptl/nptl-init.c"/>
    <File i="72173" n="/usr/src/packages/BUILD/glibc-2.11.3/nptl/../nptl/pthreadP.h"/>
    <File i="72377" n="/usr/src/packages/BUILD/glibc-2.11.3/nptl/pthread_create.c"/>
    <File i="72593" n="/usr/src/packages/BUILD/glibc-2.11.3/nptl/allocatestack.c"/>
    <File i="73006" n="/usr/src/packages/BUILD/glibc-2.11.3/nptl/pthread_mutex_lock.c"/>
    <File i="73279" n="/usr/src/packages/BUILD/glibc-2.11.3/nptl/pthread_mutex_unlock.c"/>
    <File i="73589" n="/usr/src/packages/BUILD/glibc-2.11.3/nptl/unwind.c"/>
    <File i="75094" n="/usr/src/packages/BUILD/glibc-2.11.3/posix/../sysdeps/unix/syscall-template.S"/>
    <File i="96392" n="ch3_progress.c"/>
    <File i="99247" n="gni_init.c"/>
    <File i="99506" n="gni_poll.c"/>
    <File i="101322" n="kmp_barrier.o"/>
    <File i="109932" n="z_Linux_util.o"/>
    <File i="110042" n="~unknown-file~"/>
    <File i="110225" n=""/>
    <File i="110236" n=""/>
    <File i="111293" n=""/>
    <File i="112707" n=""/>
    <File i="112708" n=""/>
    <File i="113619" n=""/>
    <File i="117353" n=""/>
    <File i="117354" n=""/>
    <File i="120693" n=""/>
    <File i="120714" n=""/>
    <File i="131231" n=""/>
    <File i="131821" n=""/>
    <File i="134164" n="z_Linux_asm.o"/>
    <File i="134247" n=""/>
    <File i="135487" n=""/>
    <File i="138462" n=""/>
    <File i="171938" n="~unknown-file~"/>
  </FileTable>
  <ProcedureTable>
    <Procedure i="1160" n="__wrap_MPI_Finalize"/>
    <Procedure i="1797" n="__wrap_pthread_create"/>
    <Procedure i="37908" n="strlen"/>
    <Procedure i="37910" n="strlen"/>
    <Procedure i="48670" n="_Unwind_Find_FDE"/>
    <Procedure i="48672" n=""/>
    <Procedure i="48688" n="_Unwind_Find_registered_FDE"/>
    <Procedure i="48829" n="base_from_object"/>
    <Procedure i="48838" n="get_cie_encoding"/>
    <Procedure i="48843" n=""/>
    <Procedure i="48844" n="read_uleb128"/>
    <Procedure i="48861" n=""/>
    <Procedure i="48862" n="read_uleb128"/>
    <Procedure i="48891" n="fde_mixed_encoding_compare"/>
    <Procedure i="48893" n=""/>
    <Procedure i="48894" n="get_fde_encoding"/>
    <Procedure i="48900" n=""/>
    <Procedure i="48901" n="get_fde_encoding"/>
    <Procedure i="48910" n="frame_downheap"/>
    <Procedure i="48922" n="frame_heapsort"/>
    <Procedure i="48936" n="classify_object_over_fdes"/>
    <Procedure i="49036" n="search_object"/>
    <Procedure i="49041" n=""/>
    <Procedure i="49042" n="init_object"/>
    <Procedure i="49066" n="init_object"/>
    <Procedure i="49077" n=""/>
    <Procedure i="49078" n="end_fde_sort"/>
    <Procedure i="49092" n="end_fde_sort"/>
    <Procedure i="49093" n=""/>
    <Procedure i="49094" n="fde_split"/>
    <Procedure i="49112" n=""/>
    <Procedure i="49113" n="fde_merge"/>
    <Procedure i="49839" n="uw_frame_state_for"/>
    <Procedure i="50248" n="uw_init_context_1"/>
    <Procedure i="50341" n="read_encoded_value_with_base"/>
    <Procedure i="50460" n="_Unwind_ForcedUnwind"/>
    <Procedure i="63229" n="_IO_new_do_write"/>
    <Procedure i="63234" n="new_do_write"/>
    <Procedure i="63537" n="_IO_new_file_write"/>
    <Procedure i="63553" n="_IO_new_file_xsputn"/>
    <Procedure i="63939" n="_IO_default_xsputn"/>
    <Procedure i="64709" n="_IO_fwrite"/>
    <Procedure i="64850" n="_IO_puts"/>
    <Procedure i="69241" n="__ioctl"/>
    <Procedure i="69245" n="__mprotect"/>
    <Procedure i="70093" n="raise"/>
    <Procedure i="70098" n="-"/>
    <Procedure i="70410" n="__lll_unlock_wake"/>
    <Procedure i="70676" n="__pthread_cond_signal"/>
    <Procedure i="71080" n="pthread_cond_wait"/>
    <Procedure i="71686" n="__write_nocancel"/>
    <Procedure i="72158" n="sigcancel_handler"/>
    <Procedure i="72172" n=""/>
    <Procedure i="72173" n="__do_cancel"/>
    <Procedure i="72589" n="__pthread_create_2_1"/>
    <Procedure i="72592" n=""/>
    <Procedure i="72593" n="allocate_stack"/>
    <Procedure i="73007" n="__pthread_mutex_lock"/>
    <Procedure i="73360" n="_L_unlock_553"/>
    <Procedure i="73624" n="__pthread_unwind"/>
    <Procedure i="75131" n="__sched_yield"/>
    <Procedure i="96411" n="poll_active_fboxes"/>
    <Procedure i="99254" n="nem_gni_error_handler"/>
    <Procedure i="99519" n="MPID_nem_gni_check_localCQ"/>
    <Procedure i="101379" n="__kmp_hyper_barrier_gather(barrier_type, kmp_info*, int, int, void (*)(void*, void*), void*)"/>
    <Procedure i="101393" n="__kmp_hyper_barrier_release(barrier_type, kmp_info*, int, int, int, void*)"/>
    <Procedure i="110000" n="__kmp_launch_worker(void*)"/>
    <Procedure i="110224" n="GNII_DlaProgress"/>
    <Procedure i="111291" n="GNI_CqGetEvent"/>
    <Procedure i="112206" n="GNI_SmsgGetNextWTag"/>
    <Procedure i="112255" n="GNI_WaitErrorEvents"/>
    <Procedure i="112706" n="MPIDI_CH3I_Progress"/>
    <Procedure i="113618" n="MPIDI_CH3U_VC_WaitForClose"/>
    <Procedure i="117352" n="MPIDI_PG_Close_VCs"/>
    <Procedure i="117623" n="MPIDU_Sched_are_pending"/>
    <Procedure i="118202" n="MPID_Finalize"/>
    <Procedure i="120689" n="MPID_nem_gni_poll"/>
    <Procedure i="121329" n="MPID_nem_network_poll"/>
    <Procedure i="128778" n="MPIU_nem_gni_task_is_not_app"/>
    <Procedure i="129036" n="MPI_Finalize"/>
    <Procedure i="131230" n="__kmp_allocate_team"/>
    <Procedure i="131300" n="__kmp_allocate_thread"/>
    <Procedure i="131816" n="__kmp_create_monitor"/>
    <Procedure i="133522" n="__kmp_fork_barrier(int, int)"/>
    <Procedure i="133544" n="__kmp_fork_call"/>
    <Procedure i="134163" n="__kmp_invoke_microtask"/>
    <Procedure i="134164" n="L_kmp_invoke_pass_parms"/>
    <Procedure i="134171" n="__kmp_invoke_task_func"/>
    <Procedure i="134206" n="__kmp_join_barrier(int)"/>
    <Procedure i="134232" n="__kmp_join_call"/>
    <Procedure i="134246" n="__kmp_launch_thread"/>
    <Procedure i="135123" n="__kmp_resume_64"/>
    <Procedure i="135306" n="__kmp_store_x87_fpu_control_word"/>
    <Procedure i="135485" n="__kmp_suspend_64"/>
    <Procedure i="137766" n="__kmpc_fork_call"/>
    <Procedure i="138454" n="main"/>
    <Procedure i="171939" n="Partial Call Paths"/>
  </ProcedureTable>
  <Info/>
</SecHeader>
<SecCallPathProfileData>
<M n="624" v="6.90803e+07"/>
<PF i="2" s="99254" l="0" lm="2" f="99247" n="99254">
<M n="624" v="15047"/>
<C i="3" s="99256" l="0">
<M n="624" v="5123"/>
<PF i="4" s="128778" l="0" lm="2" f="110042" n="128778">
<M n="624" v="5123"/>
<C i="5" s="128784" l="0">
<M n="624" v="5123"/>
<PF i="6" s="64709" l="37" lm="2" f="64708" n="64709">
<M n="624" v="5123"/>
<C i="7" s="64721" l="45">
<M n="624" v="5123"/>
<PF i="8" s="63553" l="1288" lm="2" f="63041" n="63553">
<M n="624" v="5123"/>
<C i="9" s="63590" l="1372">
<M n="624" v="5123"/>
<PF i="10" s="63939" l="452" lm="2" f="63704" n="63939">
<M n="624" v="5123"/><M n="625" v="5123"/>
<S i="11" s="63940" l="452" it="57"/>
<L i="12" s="63943" l="488" f="63704">
<M n="624" v="5123"/>
<L i="13" s="63951" l="480" f="63704">
<M n="624" v="5123"/><M n="625" v="5123"/>
<S i="14" s="63953" l="480">
<M n="624" v="5123"/><M n="625" v="5123"/>
</S>
</L>
</L>
</PF>
</C>
</PF>
</C>
</PF>
</C>
</PF>
</C>
<L i="15" s="99260" l="0" f="99247">
<M n="624" v="9924"/>
<C i="16" s="99262" l="0">
<M n="624" v="9924"/>
<PF i="17" s="112255" l="0" lm="2" f="110042" n="112255">
<M n="624" v="9924"/>
<C i="18" s="112257" l="0">
<M n="624" v="9924"/>
<PF i="19" s="69241" l="82" lm="2" f="69230" n="69241">
<M n="624" v="9924"/><M n="625" v="9924"/>
<S i="20" s="69243" l="82" it="53">
<M n="624" v="9924"/><M n="625" v="9924"/>
</S>
</PF>
</C>
</PF>
</C>
</L>
</PF>
<PF i="21" s="110000" l="0" lm="2" f="109932" n="110000">
<M n="624" v="2.54101e+07"/>
<C i="22" s="110015" l="0">
<M n="624" v="2.54101e+07"/>
<PF i="23" s="134246" l="0" lm="2" f="110042" n="134246">
<M n="624" v="2.54101e+07"/>
<L i="24" s="134247" l="0" f="134247">
<M n="624" v="2.54101e+07"/>
<C i="25" s="134249" l="0">
<M n="624" v="1.35349e+07"/>
<PF i="26" s="133522" l="0" lm="2" f="110042" n="133522">
<M n="624" v="1.35349e+07"/>
<C i="27" s="133538" l="0">
<M n="624" v="1.35349e+07"/>
<PF i="28" s="101393" l="0" lm="2" f="101322" n="101393">
<M n="624" v="1.35349e+07"/>
<L i="29" s="101394" l="0" f="101322">
<M n="624" v="1.35349e+07"/>
<C i="30" s="101395" l="0">
<M n="624" v="4.23803e+06"/>
<PF i="31" s="75131" l="82" lm="2" f="75094" n="75131">
<M n="624" v="4.23803e+06"/><M n="625" v="4.23803e+06"/>
<S i="32" s="75133" l="82" it="221">
<M n="624" v="4.23803e+06"/><M n="625" v="4.23803e+06"/>
</S>
</PF>
</C>
<C i="33" s="101397" l="0">
<M n="624" v="6.19388e+06"/>
<PF i="34" s="135485" l="0" lm="2" f="110042" n="135485">
<M n="624" v="6.19388e+06"/>
<L i="35" s="135487" l="0" f="135487">
<M n="624" v="5.96988e+06"/>
<C i="36" s="135489" l="0">
<M n="624" v="5.96988e+06"/>
<PF i="37" s="71080" l="50" lm="2" f="71079" n="71080">
<M n="624" v="5.96988e+06"/><M n="625" v="5.96988e+06"/>
<S i="38" s="71081" l="50" it="405"/>
<L i="39" s="71133" l="274" f="71079">
<M n="624" v="5.96988e+06"/><M n="625" v="5.96988e+06"/>
<S i="40" s="71161" l="181">
<M n="624" v="2.03087e+06"/><M n="625" v="2.03087e+06"/>
</S>
<S i="41" s="71162" l="183">
<M n="624" v="1.80301e+06"/><M n="625" v="1.80301e+06"/>
</S>
<S i="42" s="71168" l="197">
<M n="624" v="2.136e+06"/><M n="625" v="2.136e+06"/>
</S>
</L>
</PF>
</C>
</L>
<C i="43" s="135493" l="0">
<M n="624" v="224001"/>
<PF i="44" s="73360" l="290" lm="2" f="73279" n="73360">
<M n="624" v="224001"/>
<C i="45" s="73362" l="290">
<M n="624" v="224001"/>
<PF i="46" s="70410" l="353" lm="2" f="70278" n="70410">
<M n="624" v="224001"/><M n="625" v="224001"/>
<S i="47" s="70411" l="353" it="409"/>
<S i="48" s="70418" l="366">
<M n="624" v="224001"/><M n="625" v="224001"/>
</S>
</PF>
</C>
</PF>
</C>
</PF>
</C>
<L i="49" s="101398" l="0" f="101322">
<M n="624" v="3.103e+06"/>
<L i="50" s="101399" l="0" f="101322">
<M n="624" v="3.103e+06"/>
<C i="51" s="101401" l="0">
<M n="624" v="3.103e+06"/>
<PF i="52" s="135123" l="0" lm="2" f="110042" n="135123">
<M n="624" v="3.103e+06"/>
<C i="53" s="135128" l="0">
<M n="624" v="3.103e+06"/>
<PF i="54" s="70676" l="38" lm="2" f="70675" n="70676">
<M n="624" v="3.103e+06"/><M n="625" v="3.103e+06"/>
<S i="55" s="70678" l="38" it="245"/>
<S i="56" s="70703" l="89">
<M n="624" v="3.103e+06"/><M n="625" v="3.103e+06"/>
</S>
</PF>
</C>
</PF>
</C>
</L>
</L>
</L>
</PF>
</C>
</PF>
</C>
<C i="57" s="134250" l="0">
<M n="624" v="2.00399e+06"/>
<PF i="58" s="135306" l="0" lm="2" f="110042" n="135306">
<M n="624" v="2.00399e+06"/><M n="625" v="2.00399e+06"/>
<S i="59" s="135307" l="0" it="407">
<M n="624" v="2.00399e+06"/><M n="625" v="2.00399e+06"/>
</S>
</PF>
</C>
<C i="60" s="134253" l="0">
<M n="624" v="2.017e+06"/>
<PF i="61" s="134171" l="0" lm="2" f="110042" n="134171">
<M n="624" v="2.017e+06"/>
<C i="62" s="134174" l="0">
<M n="624" v="2.017e+06"/>
<PF i="63" s="134163" l="0" lm="2" f="110042" n="134163">
<M n="624" v="2.017e+06"/>
<Pr i="64" s="134164" l="0" lm="2" f="134164" n="134164" a="1">
<M n="624" v="2.017e+06"/>
<C i="65" s="134166" l="0">
<M n="624" v="2.017e+06"/>
<PF i="66" s="138454" l="0" lm="2" f="110042" n="138454">
<M n="624" v="2.017e+06"/>
<C i="67" s="138471" l="0">
<M n="624" v="2.017e+06"/>
<PF i="68" s="64850" l="35" lm="2" f="64849" n="64850">
<M n="624" v="2.017e+06"/>
<C i="69" s="64861" l="40">
<M n="624" v="2.017e+06"/>
<PF i="70" s="63553" l="1288" lm="2" f="63041" n="63553">
<M n="624" v="2.017e+06"/>
<C i="71" s="63579" l="1350">
<M n="624" v="2.017e+06"/>
<PF i="72" s="63229" l="493" lm="2" f="63041" n="63229">
<M n="624" v="2.017e+06"/>
<C i="73" s="63232" l="494">
<M n="624" v="2.017e+06"/>
<PF i="74" s="63234" l="505" lm="2" f="63041" n="63234">
<M n="624" v="2.017e+06"/>
<C i="75" s="63244" l="522">
<M n="624" v="2.017e+06"/>
<PF i="76" s="63537" l="1261" lm="2" f="63041" n="63537">
<M n="624" v="2.017e+06"/>
<L i="77" s="63542" l="1275" f="63041">
<M n="624" v="2.017e+06"/>
<C i="78" s="63545" l="1268">
<M n="624" v="2.017e+06"/>
<PF i="79" s="71686" l="82" lm="2" f="71619" n="71686">
<M n="624" v="2.017e+06"/><M n="625" v="2.017e+06"/>
<S i="80" s="71688" l="82" it="247">
<M n="624" v="2.017e+06"/><M n="625" v="2.017e+06"/>
</S>
</PF>
</C>
</L>
</PF>
</C>
</PF>
</C>
</PF>
</C>
</PF>
</C>
</PF>
</C>
</PF>
</C>
</Pr>
</PF>
</C>
</PF>
</C>
<C i="81" s="134255" l="0">
<M n="624" v="7.85422e+06"/>
<PF i="82" s="134206" l="0" lm="2" f="110042" n="134206">
<M n="624" v="7.85422e+06"/>
<C i="83" s="134229" l="0">
<M n="624" v="7.85422e+06"/>
<PF i="84" s="101379" l="0" lm="2" f="101322" n="101379">
<M n="624" v="7.85422e+06"/>
<L i="85" s="101380" l="0" f="101322">
<M n="624" v="7.85422e+06"/>
<L i="86" s="101381" l="0" f="101322">
<M n="624" v="4.24799e+06"/>
<L i="87" s="101382" l="0" f="101322">
<M n="624" v="4.24799e+06"/>
<C i="88" s="101386" l="0">
<M n="624" v="4.24799e+06"/>
<PF i="89" s="135485" l="0" lm="2" f="110042" n="135485">
<M n="624" v="4.24799e+06"/>
<C i="90" s="135486" l="0">
<M n="624" v="1.996e+06"/>
<PF i="91" s="73007" l="47" lm="2" f="73006" n="73007">
<M n="624" v="1.996e+06"/><M n="625" v="1.996e+06"/>
<S i="92" s="73008" l="50">
<M n="624" v="1.996e+06"/><M n="625" v="1.996e+06"/>
</S>
<L i="93" s="73029" l="109" f="73006">
<S i="94" s="73030" l="47" it="237"/>
</L>
</PF>
</C>
<L i="95" s="135487" l="0" f="135487">
<M n="624" v="2.252e+06"/>
<C i="96" s="135489" l="0">
<M n="624" v="2.252e+06"/>
<PF i="97" s="71080" l="50" lm="2" f="71079" n="71080">
<M n="624" v="2.252e+06"/><M n="625" v="2.252e+06"/>
<S i="98" s="71081" l="50" it="223"/>
<L i="99" s="71133" l="274" f="71079">
<M n="624" v="2.252e+06"/><M n="625" v="2.252e+06"/>
<S i="100" s="71162" l="183">
<M n="624" v="2.252e+06"/><M n="625" v="2.252e+06"/>
</S>
</L>
</PF>
</C>
</L>
</PF>
</C>
</L>
</L>
<C i="101" s="101392" l="0">
<M n="624" v="3.60623e+06"/>
<PF i="102" s="135123" l="0" lm="2" f="110042" n="135123">
<M n="624" v="3.60623e+06"/>
<C i="103" s="135128" l="0">
<M n="624" v="3.60623e+06"/>
<PF i="104" s="70676" l="38" lm="2" f="70675" n="70676">
<M n="624" v="3.60623e+06"/><M n="625" v="3.60623e+06"/>
<S i="105" s="70678" l="38" it="239"/>
<S i="106" s="70703" l="89">
<M n="624" v="3.60623e+06"/><M n="625" v="3.60623e+06"/>
</S>
</PF>
</C>
</PF>
</C>
</L>
</PF>
</C>
</PF>
</C>
</L>
</PF>
</C>
</PF>
<PF i="107" s="138454" l="0" lm="2" f="110042" n="138454">
<M n="624" v="1.73919e+07"/>
<L i="108" s="138462" l="0" f="138462">
<M n="624" v="5.94244e+06"/>
<C i="109" s="138465" l="0">
<M n="624" v="5.94244e+06"/>
<PF i="110" s="137766" l="0" lm="2" f="110042" n="137766">
<M n="624" v="5.94244e+06"/>
<C i="111" s="137769" l="0">
<M n="624" v="4.26245e+06"/>
<PF i="112" s="133544" l="0" lm="2" f="110042" n="133544">
<M n="624" v="4.26245e+06"/>
<C i="113" s="133580" l="0">
<M n="624" v="4.26124e+06"/>
<PF i="114" s="133522" l="0" lm="2" f="110042" n="133522">
<M n="624" v="4.26124e+06"/>
<C i="115" s="133538" l="0">
<M n="624" v="4.26124e+06"/>
<PF i="116" s="101393" l="0" lm="2" f="101322" n="101393">
<M n="624" v="4.26124e+06"/>
<L i="117" s="101394" l="0" f="101322">
<M n="624" v="4.26124e+06"/>
<L i="118" s="101398" l="0" f="101322">
<M n="624" v="4.26124e+06"/>
<L i="119" s="101399" l="0" f="101322">
<M n="624" v="4.26124e+06"/>
<C i="120" s="101401" l="0">
<M n="624" v="4.26124e+06"/>
<PF i="121" s="135123" l="0" lm="2" f="110042" n="135123">
<M n="624" v="4.26124e+06"/>
<C i="122" s="135128" l="0">
<M n="624" v="4.26124e+06"/>
<PF i="123" s="70676" l="38" lm="2" f="70675" n="70676">
<M n="624" v="4.26124e+06"/><M n="625" v="4.26124e+06"/>
<S i="124" s="70678" l="38" it="229"/>
<S i="125" s="70703" l="89">
<M n="624" v="4.26124e+06"/><M n="625" v="4.26124e+06"/>
</S>
</PF>
</C>
</PF>
</C>
</L>
</L>
</L>
</PF>
</C>
</PF>
</C>
<C i="126" s="133590" l="0">
<M n="624" v="1210"/>
<PF i="127" s="131230" l="0" lm="2" f="110042" n="131230">
<M n="624" v="1210"/>
<L i="128" s="131231" l="0" f="131231">
<M n="624" v="1210"/>
<C i="129" s="131242" l="0">
<M n="624" v="1210"/>
<PF i="130" s="131300" l="0" lm="2" f="110042" n="131300">
<M n="624" v="1210"/>
<C i="131" s="131334" l="0">
<M n="624" v="1210"/>
<PF i="132" s="131816" l="0" lm="2" f="110042" n="131816">
<M n="624" v="1210"/>
<L i="133" s="131821" l="0" f="131821">
<M n="624" v="1210"/>
<C i="134" s="131824" l="0">
<M n="624" v="1210"/>
<PF i="135" s="1797" l="1008" lm="2" f="1225" n="1797">
<M n="624" v="1210"/>
<C i="136" s="1919" l="1071">
<M n="624" v="1210"/>
<PF i="137" s="72589" l="443" lm="2" f="72377" n="72589">
<M n="624" v="1210"/>
<Pr i="138" s="72592" l="453" lm="2" f="72377" n="72592" a="1">
<M n="624" v="1210"/>
<Pr i="139" s="72593" l="350" lm="2" f="72593" n="72593" a="1">
<M n="624" v="1210"/>
<C i="140" s="72730" l="637">
<M n="624" v="1210"/>
<PF i="141" s="69245" l="82" lm="2" f="69230" n="69245">
<M n="624" v="1210"/><M n="625" v="1210"/>
<S i="142" s="69247" l="82" it="65">
<M n="624" v="1210"/><M n="625" v="1210"/>
</S>
</PF>
</C>
</Pr>
</Pr>
</PF>
</C>
</PF>
</C>
</L>
</PF>
</C>
</PF>
</C>
</L>
</PF>
</C>
</PF>
</C>
<C i="143" s="137770" l="0">
<M n="624" v="1.67999e+06"/>
<PF i="144" s="134232" l="0" lm="2" f="110042" n="134232">
<M n="624" v="1.67999e+06"/>
<C i="145" s="134235" l="0">
<M n="624" v="1.67999e+06"/>
<PF i="146" s="134206" l="0" lm="2" f="110042" n="134206">
<M n="624" v="1.67999e+06"/>
<C i="147" s="134229" l="0">
<M n="624" v="1.67999e+06"/>
<PF i="148" s="101379" l="0" lm="2" f="101322" n="101379">
<M n="624" v="1.67999e+06"/>
<L i="149" s="101380" l="0" f="101322">
<M n="624" v="1.67999e+06"/>
<L i="150" s="101381" l="0" f="101322">
<M n="624" v="1.67999e+06"/>
<L i="151" s="101382" l="0" f="101322">
<M n="624" v="1.67999e+06"/>
<C i="152" s="101386" l="0">
<M n="624" v="1.67999e+06"/>
<PF i="153" s="135485" l="0" lm="2" f="110042" n="135485">
<M n="624" v="1.67999e+06"/>
<L i="154" s="135487" l="0" f="135487">
<M n="624" v="1.67999e+06"/>
<C i="155" s="135489" l="0">
<M n="624" v="1.67999e+06"/>
<PF i="156" s="71080" l="50" lm="2" f="71079" n="71080">
<M n="624" v="1.67999e+06"/><M n="625" v="1.67999e+06"/>
<S i="157" s="71081" l="50" it="335"/>
<L i="158" s="71133" l="274" f="71079">
<M n="624" v="1.67999e+06"/><M n="625" v="1.67999e+06"/>
<S i="159" s="71162" l="183">
<M n="624" v="1.67999e+06"/><M n="625" v="1.67999e+06"/>
</S>
</L>
</PF>
</C>
</L>
</PF>
</C>
</L>
</L>
</L>
</PF>
</C>
</PF>
</C>
</PF>
</C>
</PF>
</C>
</L>
<C i="160" s="138469" l="0">
<M n="624" v="1.14494e+07"/>
<PF i="161" s="1160" l="22" lm="2" f="1159" n="1160">
<M n="624" v="1.14494e+07"/>
<C i="162" s="1181" l="34">
<M n="624" v="1.14494e+07"/>
<PF i="163" s="129036" l="0" lm="2" f="110042" n="129036">
<M n="624" v="1.14494e+07"/>
<C i="164" s="129042" l="0">
<M n="624" v="1.14494e+07"/>
<PF i="165" s="118202" l="0" lm="2" f="110042" n="118202">
<M n="624" v="1.14494e+07"/>
<C i="166" s="118207" l="0">
<M n="624" v="1.14494e+07"/>
<PF i="167" s="117352" l="0" lm="2" f="110042" n="117352">
<M n="624" v="1.14494e+07"/>